id,name,description,version,steward
NQF2372,Breast Cancer Screening,Percentage of women 50 - 74 years of age who had a mammogram to screen for breast cancer in the 27 months prior to the end of the measurement period.,2023,NQF
NQF0034,Colorectal Cancer Screening,Percentage of patients 45 - 75 years of age who had appropriate screening for colorectal cancer,2023,NQF
NQF0059,Diabetes: Hemoglobin A1c (HbA1c) Poor Control (> 9%),Percentage of patients 18-75 years of age with diabetes who had hemoglobin A1c > 9.0% during the measurement period.,2023,NQF
CQM236,Controlling High Blood Pressure,"Percentage of patients 18-85 years of age who had a diagnosis of essential hypertension starting before and continuing into, or starting during the first six months of the measurement period, and whose most recent blood pressure was adequately controlled (<140/90mmHg) during the measurement period.",2023,MIPS CQM
NQF0053,Osteoporosis Management in Women Who Had a Fracture,The percentage of women 50–85 years of age who suffered a fracture and who had either a bone mineral density (BMD) test or prescription for a drug to treat osteoporosis in the six months after the fracture.,2023,NQF